{"authority_boundary":{"authority_scope":"bounded_frozen_parameter_edit_only","edit_oracle_authority":"verified_replay","generated_cadquery_proxy_used":false,"independent_occ_reconstruction_used":false,"nominal_geometry_authority":"native_cadquery_execution","source_native_execution_used":true},"geometry_contract":{"comparison_protocol":{"checks":["valid_solid","solid_count","volume","surface_area","bounding_box","symmetric_difference_volume"],"method":"canonical_step_solid_set_comparison_v1","tolerance_profile":"cadengbench-p-default-mm-v1"},"geometry_change_required":true,"observed_delta":{"bbox_after":{"xmax":50.69,"xmin":-50.69,"ymax":50.69,"ymin":-50.69,"zmax":8.712,"zmin":0.0},"bbox_before":{"xmax":50.69000000000655,"xmin":-50.69000000000655,"ymax":50.69000000000655,"ymin":-50.69000000000655,"zmax":7.92,"zmin":0.0},"edge_count_delta":0,"face_count_delta":0,"solid_count_delta":0,"volume_delta":2032.5681066424368,"volume_delta_fraction":0.1000000000009978},"solid_count_preserved":true,"target_step_is_hidden_scoring_reference":true,"topology_partition_policy":"diagnostic_not_persistent_identity","valid_solid_required":true},"item_id":"p_benchcad_000757","limitations":["The oracle covers one frozen replay-qualified CadQuery parameter binding.","Arbitrary feature insertion, deletion, freeform curve edits, and unconstrained sketch solving are outside this oracle."],"llm_judge_used":false,"oracle_id":"p_benchcad_000757:edit-target:v2","parameter_contract":{"base_value":7.92,"canonical_unit":"mm","domain":{"domain_id":"p_benchcad_000757:domain:bootstrap","lower":{"unit":"mm","value":6.732},"upper":{"unit":"mm","value":9.108},"variable":{"key":"extrude_arg_0","node_type":"variable","source":"parameter","state":"current","unit":"mm"}},"feature_id":"cadquery:extrude:0","measurement":{"absolute_error":0.0,"absolute_tolerance":1e-06,"authority":"D2_verified_replay","expected_entity_count":1,"expected_value":8.712,"measured_value":8.712,"measured_values":[8.712],"measurement_name":"cadquery_parameter_mm:extrude_arg_0","measurement_status":"measured","method":"cadquery_ast_bound_literal_verified_replay_v1","observed_entity_count":1,"reason":"The frozen source binding was assigned exactly and consumed by the successful deterministic replay that produced the edited STEP oracle.","step_artifact":"data/production/cadengbench_p_1800_v2_two_source_r25/dataset/items/p_benchcad_000757/domain/parametric_edits/v2/replay/probe_01_8p712/model.step","tolerance_agreement":true,"unit":"mm"},"parameter_id":"cadquery:line:7:col:13","parameter_key":"extrude_arg_0","scale_to_canonical":1.0,"source_pointer":"line:7:col:13","source_unit":"mm","target_value":8.712,"verified_probe_values":[7.128,8.712]},"preservation_contract":{"baseline_masked_sha256":"f17bb7496c77eff07f9b4962c03437a8b59a86e02d05723103671375f460f458","constraint_system_sha256":"37517e5f3dc66819f61f5a7bb8ace1921282415f10551d2defa5c3eb0985b570","edited_masked_sha256":"f17bb7496c77eff07f9b4962c03437a8b59a86e02d05723103671375f460f458","integrity_method":"cadquery_exact_source_single_literal_masked_digest_v2","non_target_source_unchanged":true,"operation_sequence_sha256":"b16932fb21770dda7cf3ea867c611bd32c8ecdd0559644a3cb4e9ec9b6b436d9"},"qualification":{"all_probe_replays_verified":true,"evaluator_uses_llm_judge":false,"negative_conditions":["no_op_rejected","invalid_solid_rejected","solid_count_change_rejected","non_target_source_change_rejected","target_parameter_assignment_mismatch_rejected","target_brep_mismatch_rejected"],"nominal_source_equivalence_required":false,"nominal_source_equivalence_verified":true,"target_replay_verified":true},"record_type":"deterministic_edit_target_oracle","reference_artifacts":{"base_history":{"bytes":279,"path":"data/production/cadengbench_p_1800_v2_two_source_r25/dataset/items/p_benchcad_000757/source/cadquery.py","sha256":"2c532fa14bfe65531ed2d1c86691903f88238f95679dea0868fdf78c1b0c096e"},"base_step":{"bytes":30593,"path":"data/production/cadengbench_p_1800_v2_two_source_r25/dataset/items/p_benchcad_000757/source/generated_from_cadquery.step","sha256":"261dd9eca438a802edc9421b2723d6fdc413d8dc466a54b7600ff87f18983ee0"},"edit_binding_qualification":{"bytes":3485,"path":"data/production/cadengbench_p_1800_v2_two_source_r25/dataset/items/p_benchcad_000757/source/edit_binding_qualification.json","sha256":"cafdb2f685759b07484f4aa1f994f566c55708e723fefcd633158ebf5432257c"},"target_history":{"bytes":280,"path":"data/production/cadengbench_p_1800_v2_two_source_r25/dataset/items/p_benchcad_000757/domain/parametric_edits/v2/replay/probe_01_8p712/model.cadquery.py","sha256":"43e651080e32230ad9832370cf5e6312f20065fc4624511e16708a6ba4aa34cd"},"target_replay_report":{"bytes":790,"path":"data/production/cadengbench_p_1800_v2_two_source_r25/dataset/items/p_benchcad_000757/domain/parametric_edits/v2/replay/probe_01_8p712/execution.json","sha256":"324d3bd42fabab120ce4d523112b66f10f53f1a4fd4127c73db97678e761842b"},"target_step":{"bytes":30618,"path":"data/production/cadengbench_p_1800_v2_two_source_r25/dataset/items/p_benchcad_000757/domain/parametric_edits/v2/replay/probe_01_8p712/model.step","sha256":"092bc9285044fa9dbbe175aef4ba59dd218cc752d517f10d2d6bc47966b1f53c"}},"schema_version":"cadengbench-p.edit-target-oracle.v2","source_key":"benchcad","status":"verified"}
