{"authority_boundary":{"authority_scope":"bounded_frozen_parameter_edit_only","edit_oracle_authority":"verified_replay","generated_cadquery_proxy_used":false,"independent_occ_reconstruction_used":false,"nominal_geometry_authority":"native_cadquery_execution","source_native_execution_used":true},"geometry_contract":{"comparison_protocol":{"checks":["valid_solid","solid_count","volume","surface_area","bounding_box","symmetric_difference_volume"],"method":"canonical_step_solid_set_comparison_v1","tolerance_profile":"cadengbench-p-default-mm-v1"},"geometry_change_required":true,"observed_delta":{"bbox_after":{"xmax":1.61,"xmin":-1.61,"ymax":16.5165,"ymin":-16.5165,"zmax":1.61,"zmin":-1.61},"bbox_before":{"xmax":1.61,"xmin":-1.61,"ymax":15.015,"ymin":-15.015,"zmax":1.61,"zmin":-1.61},"edge_count_delta":0,"face_count_delta":0,"solid_count_delta":0,"volume_delta":31.136305200000095,"volume_delta_fraction":0.10000000000000031},"solid_count_preserved":true,"target_step_is_hidden_scoring_reference":true,"topology_partition_policy":"diagnostic_not_persistent_identity","valid_solid_required":true},"item_id":"p_benchcad_000521","limitations":["The oracle covers one frozen replay-qualified CadQuery parameter binding.","Arbitrary feature insertion, deletion, freeform curve edits, and unconstrained sketch solving are outside this oracle."],"llm_judge_used":false,"oracle_id":"p_benchcad_000521:edit-target:v2","parameter_contract":{"base_value":30.03,"canonical_unit":"mm","domain":{"domain_id":"p_benchcad_000521:domain:bootstrap","lower":{"unit":"mm","value":25.5255},"upper":{"unit":"mm","value":34.5345},"variable":{"key":"box_arg_0","node_type":"variable","source":"parameter","state":"current","unit":"mm"}},"feature_id":"cadquery:box:0","measurement":{"absolute_error":0.0,"absolute_tolerance":1e-06,"authority":"D2_verified_replay","expected_entity_count":1,"expected_value":33.033,"measured_value":33.033,"measured_values":[33.033],"measurement_name":"cadquery_parameter_mm:box_arg_0","measurement_status":"measured","method":"cadquery_ast_bound_literal_verified_replay_v1","observed_entity_count":1,"reason":"The frozen source binding was assigned exactly and consumed by the successful deterministic replay that produced the edited STEP oracle.","step_artifact":"data/production/cadengbench_p_1800_v2_two_source_r25/dataset/items/p_benchcad_000521/domain/parametric_edits/v2/replay/probe_01_33p033/model.step","tolerance_agreement":true,"unit":"mm"},"parameter_id":"cadquery:line:5:col:9","parameter_key":"box_arg_0","scale_to_canonical":1.0,"source_pointer":"line:5:col:9","source_unit":"mm","target_value":33.033,"verified_probe_values":[27.027,33.033]},"preservation_contract":{"baseline_masked_sha256":"4731bfeeef618d8fe8bd589d05cc2c72e0069ea1efd1e4264b65ca10efb0da32","constraint_system_sha256":"37517e5f3dc66819f61f5a7bb8ace1921282415f10551d2defa5c3eb0985b570","edited_masked_sha256":"4731bfeeef618d8fe8bd589d05cc2c72e0069ea1efd1e4264b65ca10efb0da32","integrity_method":"cadquery_exact_source_single_literal_masked_digest_v2","non_target_source_unchanged":true,"operation_sequence_sha256":"aeb46ba841fc47bd3ad0e49d2a91fa2ee530a28b0e4c45502579eab901359783"},"qualification":{"all_probe_replays_verified":true,"evaluator_uses_llm_judge":false,"negative_conditions":["no_op_rejected","invalid_solid_rejected","solid_count_change_rejected","non_target_source_change_rejected","target_parameter_assignment_mismatch_rejected","target_brep_mismatch_rejected"],"nominal_source_equivalence_required":false,"nominal_source_equivalence_verified":true,"target_replay_verified":true},"record_type":"deterministic_edit_target_oracle","reference_artifacts":{"base_history":{"bytes":117,"path":"data/production/cadengbench_p_1800_v2_two_source_r25/dataset/items/p_benchcad_000521/source/cadquery.py","sha256":"b426d2fe82b48b2c5abd460a51f014813c473ad3fa04c47d869e3d32262e4ec6"},"base_step":{"bytes":15650,"path":"data/production/cadengbench_p_1800_v2_two_source_r25/dataset/items/p_benchcad_000521/source/generated_from_cadquery.step","sha256":"b69989cf2b41e023f4dd881fb21906e346f76b49649ad2e951f255e59c914337"},"edit_binding_qualification":{"bytes":3291,"path":"data/production/cadengbench_p_1800_v2_two_source_r25/dataset/items/p_benchcad_000521/source/edit_binding_qualification.json","sha256":"ebd1c659c667563dd5344f6f37b0c08bd5c8f895706ad518a9279ead105f4d4a"},"target_history":{"bytes":118,"path":"data/production/cadengbench_p_1800_v2_two_source_r25/dataset/items/p_benchcad_000521/domain/parametric_edits/v2/replay/probe_01_33p033/model.cadquery.py","sha256":"1f02e64d5ba919730fc9dd9626b08916bb2b61e5f22e0e82a5d84a6aa0d5e675"},"target_replay_report":{"bytes":792,"path":"data/production/cadengbench_p_1800_v2_two_source_r25/dataset/items/p_benchcad_000521/domain/parametric_edits/v2/replay/probe_01_33p033/execution.json","sha256":"5357797f0ad3623e43adf13ccd0cf06251e891c424e4061fb23fcffcf6f066a4"},"target_step":{"bytes":15680,"path":"data/production/cadengbench_p_1800_v2_two_source_r25/dataset/items/p_benchcad_000521/domain/parametric_edits/v2/replay/probe_01_33p033/model.step","sha256":"450b4382da51a8782249026b05d17dd5eea96e5019ea210f6d246e7d107375b8"}},"schema_version":"cadengbench-p.edit-target-oracle.v2","source_key":"benchcad","status":"verified"}
